{
    "name": "Canva",
    "url": "https://www.canva.com",
    "description": "Canva is a graphic design platform that allows users to create social media graphics, presentations, posters, documents, and other visual content. It provides a user-friendly interface with drag-and-drop features and a vast library of templates and design elements.",
    "jobs": {
        "situations": [
            "want imagery to support a project"
        ],
        "motivations": [
            "create a visual identity",
            "make information more engaging"
        ],
        "outcomes": [
            "create graphic design assets",
            "create a logo",
            "create an avatar"
        ]
    },
    "evaluation": {
        "performance": "",
        "price": "",
        "customizability": "",
        "learnability": "",
        "compatibility": ""
    }
}